name,product_type,price,price_excl_tax,price_incl_tax,Availability,catagory
Being Mortal: Medicine and What Matters in the End,Books,£55.06,£55.06,£55.06,In stock (8 available),Nonfiction
Between the World and Me,Books,£56.91,£56.91,£56.91,In stock (8 available),Nonfiction
Brazen: The Courage to Find the You That's Been Hiding,Books,£19.22,£19.22,£19.22,In stock (8 available),Nonfiction
Brilliant Beacons: A History of the American Lighthouse,Books,£11.45,£11.45,£11.45,In stock (8 available),History
Diary of a Citizen Scientist: Chasing Tiger Beetles and Other New Ways of Engaging the World,Books,£28.41,£28.41,£28.41,In stock (8 available),Science
Death by Leisure: A Cautionary Tale,Books,£37.51,£37.51,£37.51,In stock (8 available),Default
"""Most Blessed of the Patriarchs"": Thomas Jefferson and the Empire of the Imagination",Books,£44.48,£44.48,£44.48,In stock (8 available),History
Ender's Game (The Ender Quintet #1),Books,£43.64,£43.64,£43.64,In stock (8 available),Default
Future Shock (Future Shock #1),Books,£55.65,£55.65,£55.65,In stock (8 available),Young Adult
Heaven is for Real: A Little Boy's Astounding Story of His Trip to Heaven and Back,Books,£52.86,£52.86,£52.86,In stock (8 available),Default
The Whale,Books,£35.96,£35.96,£35.96,In stock (7 available),Childrens
The Year of Living Biblically: One Man's Humble Quest to Follow the Bible as Literally as Possible,Books,£34.72,£34.72,£34.72,In stock (7 available),Default
Under the Tuscan Sun,Books,£37.33,£37.33,£37.33,In stock (7 available),Travel
Unreasonable Hope: Finding Faith in the God Who Brings Purpose to Your Pain,Books,£46.33,£46.33,£46.33,In stock (7 available),Spirituality
What Happened on Beale Street (Secrets of the South Mysteries #2),Books,£25.37,£25.37,£25.37,In stock (7 available),Mystery
Toddlers Are A**holes: It's Not Your Fault,Books,£25.55,£25.55,£25.55,In stock (7 available),Humor
"Sit, Stay, Love",Books,£20.90,£20.90,£20.90,In stock (7 available),Romance
Steal Like an Artist: 10 Things Nobody Told You About Being Creative,Books,£20.90,£20.90,£20.90,In stock (7 available),Default
The 7 Habits of Highly Effective People: Powerful Lessons in Personal Change,Books,£33.17,£33.17,£33.17,In stock (7 available),Default
The Art Book,Books,£32.34,£32.34,£32.34,In stock (7 available),Art
The Bachelor Girl's Guide to Murder (Herringford and Watts Mysteries #1),Books,£52.30,£52.30,£52.30,In stock (7 available),Mystery
The Bourne Identity (Jason Bourne #1),Books,£42.78,£42.78,£42.78,In stock (7 available),Fiction
Hystopia: A Novel,Books,£21.96,£21.96,£21.96,In stock (8 available),Fiction
Team of Rivals: The Political Genius of Abraham Lincoln,Books,£20.12,£20.12,£20.12,In stock (7 available),Add a comment
The Constant Princess (The Tudor Court #1),Books,£16.62,£16.62,£16.62,In stock (7 available),Historical Fiction
The Drowning Girls,Books,£35.67,£35.67,£35.67,In stock (7 available),Add a comment
The Faith of Christopher Hitchens: The Restless Soul of the World's Most Notorious Atheist,Books,£39.55,£39.55,£39.55,In stock (7 available),Biography
The Glass Castle,Books,£16.24,£16.24,£16.24,In stock (7 available),Add a comment
The Good Girl,Books,£49.03,£49.03,£49.03,In stock (7 available),Default
Playing from the Heart,Books,£32.38,£32.38,£32.38,In stock (7 available),Childrens
Raymie Nightingale,Books,£34.41,£34.41,£34.41,In stock (7 available),Childrens
"Rich Dad, Poor Dad",Books,£51.74,£51.74,£51.74,In stock (7 available),Business
"Shrunken Treasures: Literary Classics, Short, Sweet, and Silly",Books,£52.87,£52.87,£52.87,In stock (7 available),Childrens
Sister Dear,Books,£40.20,£40.20,£40.20,In stock (7 available),Fiction
The Great Gatsby,Books,£36.05,£36.05,£36.05,In stock (7 available),Default
The Origin of Species,Books,£10.01,£10.01,£10.01,In stock (7 available),Science
The Story of Art,Books,£41.14,£41.14,£41.14,In stock (7 available),Art
For the Love: Fighting for Grace in a World of Impossible Standards,Books,£45.13,£45.13,£45.13,In stock (7 available),Nonfiction
John Adams,Books,£57.43,£57.43,£57.43,In stock (7 available),Add a comment
"Fruits Basket, Vol. 7 (Fruits Basket #7)",Books,£19.57,£19.57,£19.57,In stock (7 available),Sequential Art
Good in Bed (Cannie Shapiro #1),Books,£37.05,£37.05,£37.05,In stock (7 available),Add a comment
King's Folly (The Kinsman Chronicles #1),Books,£39.61,£39.61,£39.61,In stock (7 available),Fantasy
Life of Pi,Books,£13.22,£13.22,£13.22,In stock (7 available),Default
Like Never Before (Walker Family #2),Books,£28.77,£28.77,£28.77,In stock (7 available),Christian Fiction
Memoirs of a Geisha,Books,£49.67,£49.67,£49.67,In stock (7 available),Fiction
How to Be a Domestic Goddess: Baking and the Art of Comfort Cooking,Books,£28.25,£28.25,£28.25,In stock (7 available),Food and Drink
Meternity,Books,£43.58,£43.58,£43.58,In stock (7 available),Womens Fiction
"Naturally Lean: 125 Nourishing Gluten-Free, Plant-Based Recipes--All Under 300 Calories",Books,£11.38,£11.38,£11.38,In stock (7 available),Food and Drink
How to Cook Everything Vegetarian: Simple Meatless Recipes for Great Food (How to Cook Everything),Books,£46.01,£46.01,£46.01,In stock (7 available),Food and Drink
Nightstruck: A Novel,Books,£50.35,£50.35,£50.35,In stock (7 available),Young Adult
Blue Like Jazz: Nonreligious Thoughts on Christian Spirituality,Books,£25.77,£25.77,£25.77,In stock (7 available),Christian
Counted With the Stars (Out from Egypt #1),Books,£17.97,£17.97,£17.97,In stock (7 available),Christian Fiction
Delivering the Truth (Quaker Midwife Mystery #1),Books,£20.89,£20.89,£20.89,In stock (7 available),Mystery
Leave This Song Behind: Teen Poetry at Its Best,Books,£51.17,£51.17,£51.17,In stock (7 available),Poetry
"Chronicles, Vol. 1",Books,£52.60,£52.60,£52.60,In stock (7 available),Music
Finding God in the Ruins: How God Redeems Pain,Books,£46.64,£46.64,£46.64,In stock (7 available),Nonfiction
The Perks of Being a Wallflower,Books,£55.02,£55.02,£55.02,In stock (6 available),Default
The Rise and Fall of the Third Reich: A History of Nazi Germany,Books,£39.67,£39.67,£39.67,In stock (6 available),History
The Sound Of Love,Books,£57.84,£57.84,£57.84,In stock (6 available),Default
A Short History of Nearly Everything,Books,£52.40,£52.40,£52.40,In stock (7 available),History
A Gathering of Shadows (Shades of Magic #2),Books,£44.81,£44.81,£44.81,In stock (7 available),Fantasy
"At The Existentialist Café: Freedom, Being, and apricot cocktails with: Jean-Paul Sartre, Simone de Beauvoir, Albert Camus, Martin Heidegger, Edmund Husserl, Karl Jaspers, Maurice Merleau-Ponty and others",Books,£29.93,£29.93,£29.93,In stock (7 available),Philosophy
Benjamin Franklin: An American Life,Books,£48.19,£48.19,£48.19,In stock (7 available),Biography
The Collected Poems of W.B. Yeats (The Collected Works of W.B. Yeats #1),Books,£15.42,£15.42,£15.42,In stock (6 available),Poetry
A Summer In Europe,Books,£44.34,£44.34,£44.34,In stock (7 available),Travel
The Girl You Left Behind (The Girl You Left Behind #1),Books,£15.79,£15.79,£15.79,In stock (6 available),Historical
The Fellowship of the Ring (The Lord of the Rings #1),Books,£10.27,£10.27,£10.27,In stock (6 available),Default
The God Delusion,Books,£46.85,£46.85,£46.85,In stock (6 available),Add a comment
The Golden Compass (His Dark Materials #1),Books,£18.77,£18.77,£18.77,In stock (6 available),Add a comment
The Great Railway Bazaar,Books,£30.54,£30.54,£30.54,In stock (6 available),Travel
The Invention of Wings,Books,£37.34,£37.34,£37.34,In stock (6 available),Historical Fiction
The Joy of Cooking,Books,£43.27,£43.27,£43.27,In stock (6 available),Add a comment
The Makings of a Fatherless Child,Books,£31.58,£31.58,£31.58,In stock (6 available),Default
The Man Who Mistook His Wife for a Hat and Other Clinical Tales,Books,£59.45,£59.45,£59.45,In stock (6 available),Nonfiction
The Mysterious Affair at Styles (Hercule Poirot #1),Books,£24.80,£24.80,£24.80,In stock (6 available),Mystery
The Hobbit (Middle-Earth Universe),Books,£17.80,£17.80,£17.80,In stock (6 available),Default
How to Stop Worrying and Start Living,Books,£46.49,£46.49,£46.49,In stock (6 available),Self Help
In Cold Blood,Books,£49.98,£49.98,£49.98,In stock (6 available),Nonfiction
Give It Back,Books,£18.32,£18.32,£18.32,In stock (6 available),Thriller
In the Woods (Dublin Murder Squad #1),Books,£38.38,£38.38,£38.38,In stock (6 available),Mystery
Me Before You (Me Before You #1),Books,£19.02,£19.02,£19.02,In stock (6 available),Fiction
Mere Christianity,Books,£48.51,£48.51,£48.51,In stock (6 available),Add a comment
Tell the Wolves I'm Home,Books,£50.96,£50.96,£50.96,In stock (6 available),Young Adult
Pride and Prejudice,Books,£19.27,£19.27,£19.27,In stock (6 available),Add a comment
Ship Leaves Harbor: Essays on Travel by a Recovering Journeyman,Books,£30.60,£30.60,£30.60,In stock (6 available),Default
The Barefoot Contessa Cookbook,Books,£59.92,£59.92,£59.92,In stock (6 available),Food and Drink
A Year in Provence (Provence #1),Books,£56.88,£56.88,£56.88,In stock (6 available),Travel
Musicophilia: Tales of Music and the Brain,Books,£46.58,£46.58,£46.58,In stock (6 available),Default
Every Heart a Doorway (Every Heart A Doorway #1),Books,£12.16,£12.16,£12.16,In stock (7 available),Fantasy
An Unquiet Mind: A Memoir of Moods and Madness,Books,£21.30,£21.30,£21.30,In stock (6 available),Psychology
Catherine the Great: Portrait of a Woman,Books,£58.55,£58.55,£58.55,In stock (6 available),History
Better Homes and Gardens New Cook Book,Books,£39.61,£39.61,£39.61,In stock (6 available),Food and Drink
"Death Note, Vol. 6: Give-and-Take (Death Note #6)",Books,£36.39,£36.39,£36.39,In stock (6 available),Sequential Art
Deception Point,Books,£40.32,£40.32,£40.32,In stock (6 available),Fiction
"Fruits Basket, Vol. 6 (Fruits Basket #6)",Books,£20.96,£20.96,£20.96,In stock (6 available),Sequential Art
Fun Home: A Family Tragicomic,Books,£56.59,£56.59,£56.59,In stock (6 available),Add a comment
The Power Greens Cookbook: 140 Delicious Superfood Recipes,Books,£11.05,£11.05,£11.05,In stock (5 available),Food and Drink
The Raven Boys (The Raven Cycle #1),Books,£57.74,£57.74,£57.74,In stock (5 available),Fantasy
The Raven King (The Raven Cycle #4),Books,£30.57,£30.57,£30.57,In stock (5 available),Add a comment
The Secret Garden,Books,£15.08,£15.08,£15.08,In stock (5 available),Classics
This Is Your Brain on Music: The Science of a Human Obsession,Books,£38.40,£38.40,£38.40,In stock (5 available),Music
Two Summers,Books,£14.64,£14.64,£14.64,In stock (5 available),Young Adult
"Girl, Interrupted",Books,£42.14,£42.14,£42.14,In stock (6 available),Nonfiction
Where She Went (If I Stay #2),Books,£41.73,£41.73,£41.73,In stock (5 available),Young Adult
The Expatriates,Books,£44.58,£44.58,£44.58,In stock (5 available),Fiction
The False Prince (The Ascendance Trilogy #1),Books,£56.00,£56.00,£56.00,In stock (5 available),Fantasy
The Fault in Our Stars,Books,£47.22,£47.22,£47.22,In stock (5 available),Default
The Firm,Books,£45.56,£45.56,£45.56,In stock (5 available),Fiction
What If?: Serious Scientific Answers to Absurd Hypothetical Questions,Books,£53.68,£53.68,£53.68,In stock (5 available),Default
The Hiding Place,Books,£55.91,£55.91,£55.91,In stock (5 available),History
The Little Paris Bookshop,Books,£24.73,£24.73,£24.73,In stock (5 available),Fiction
The Mathews Men: Seven Brothers and the War Against Hitler's U-boats,Books,£42.91,£42.91,£42.91,In stock (5 available),History
The Metamorphosis,Books,£28.58,£28.58,£28.58,In stock (5 available),Classics
Why Save the Bankers?: And Other Essays on Our Economic and Political Crisis,Books,£48.67,£48.67,£48.67,In stock (5 available),Nonfiction
The Grand Design,Books,£13.76,£13.76,£13.76,In stock (5 available),Science
World Without End (The Pillars of the Earth #2),Books,£32.97,£32.97,£32.97,In stock (5 available),Historical Fiction
"Will Grayson, Will Grayson (Will Grayson, Will Grayson)",Books,£47.31,£47.31,£47.31,In stock (5 available),Young Adult
The Dream Thieves (The Raven Cycle #2),Books,£34.50,£34.50,£34.50,In stock (5 available),Default
Kill the Boy Band,Books,£15.52,£15.52,£15.52,In stock (5 available),Young Adult
Killing Floor (Jack Reacher #1),Books,£31.49,£31.49,£31.49,In stock (5 available),Thriller
Last One Home (New Beginnings #1),Books,£59.98,£59.98,£59.98,In stock (5 available),Fiction
Lola and the Boy Next Door (Anna and the French Kiss #2),Books,£23.63,£23.63,£23.63,In stock (5 available),Young Adult
Maybe Something Beautiful: How Art Transformed a Neighborhood,Books,£22.54,£22.54,£22.54,In stock (5 available),Childrens
Mexican Today: New and Rediscovered Recipes for Contemporary Kitchens,Books,£24.91,£24.91,£24.91,In stock (5 available),Food and Drink
My Mother Was Nuts,Books,£31.63,£31.63,£31.63,In stock (5 available),Nonfiction
Peak: Secrets from the New Science of Expertise,Books,£16.28,£16.28,£16.28,In stock (5 available),Science
Red Dragon (Hannibal Lecter #1),Books,£23.37,£23.37,£23.37,In stock (5 available),Horror
Logan Kade (Fallen Crest High #5.5),Books,£13.12,£13.12,£13.12,In stock (5 available),Academic
Remember Me?,Books,£11.48,£11.48,£11.48,In stock (5 available),Default
Siddhartha,Books,£34.22,£34.22,£34.22,In stock (5 available),Fiction
Tell the Wind and Fire,Books,£45.51,£45.51,£45.51,In stock (5 available),Fantasy
Talking to Girls About Duran Duran: One Young Man's Quest for True Love and a Cooler Haircut,Books,£25.15,£25.15,£25.15,In stock (5 available),Nonfiction
The 5th Wave (The 5th Wave #1),Books,£11.83,£11.83,£11.83,In stock (5 available),Default
Tell Me Three Things,Books,£41.81,£41.81,£41.81,In stock (5 available),Young Adult
The Crossover,Books,£38.77,£38.77,£38.77,In stock (5 available),Poetry
The Darkest Corners,Books,£11.33,£11.33,£11.33,In stock (5 available),Young Adult
Shiver (The Wolves of Mercy Falls #1),Books,£16.23,£16.23,£16.23,In stock (5 available),Default
Foundation (Foundation (Publication Order) #1),Books,£32.42,£32.42,£32.42,In stock (5 available),Science Fiction
"Fruits Basket, Vol. 5 (Fruits Basket #5)",Books,£16.33,£16.33,£16.33,In stock (5 available),Sequential Art
Harry Potter and the Deathly Hallows (Harry Potter #7),Books,£23.32,£23.32,£23.32,In stock (5 available),Default
If I Stay (If I Stay #1),Books,£38.13,£38.13,£38.13,In stock (5 available),Default
I Know Why the Caged Bird Sings (Maya Angelou's Autobiography #1),Books,£36.55,£36.55,£36.55,In stock (5 available),Default
Isla and the Happily Ever After (Anna and the French Kiss #3),Books,£48.13,£48.13,£48.13,In stock (5 available),Young Adult
An Abundance of Katherines,Books,£10.00,£10.00,£10.00,In stock (5 available),Young Adult
Approval Junkie: Adventures in Caring Too Much,Books,£58.81,£58.81,£58.81,In stock (5 available),Autobiography
"Blue Lily, Lily Blue (The Raven Cycle #3)",Books,£34.13,£34.13,£34.13,In stock (5 available),Default
Booked,Books,£17.49,£17.49,£17.49,In stock (5 available),Poetry
Critique of Pure Reason,Books,£20.75,£20.75,£20.75,In stock (5 available),Philosophy
"Data, A Love Story: How I Gamed Online Dating to Meet My Match",Books,£32.35,£32.35,£32.35,In stock (5 available),Nonfiction
America's War for the Greater Middle East: A Military History,Books,£51.22,£51.22,£51.22,In stock (5 available),History
"Death Note, Vol. 5: Whiteout (Death Note #5)",Books,£52.41,£52.41,£52.41,In stock (5 available),Sequential Art
Digital Fortress,Books,£58.00,£58.00,£58.00,In stock (5 available),Fiction
Dracula the Un-Dead,Books,£35.63,£35.63,£35.63,In stock (5 available),Horror
Drama,Books,£38.70,£38.70,£38.70,In stock (5 available),Default
Evicted: Poverty and Profit in the American City,Books,£42.27,£42.27,£42.27,In stock (5 available),Add a comment
Fool Me Once,Books,£16.96,£16.96,£16.96,In stock (5 available),Default
The Demonists (Demonist #1),Books,£52.11,£52.11,£52.11,In stock (4 available),Fantasy
"The Demon Prince of Momochi House, Vol. 4 (The Demon Prince of Momochi House #4)",Books,£27.88,£27.88,£27.88,In stock (4 available),Sequential Art
The Geography of Bliss: One Grump's Search for the Happiest Places in the World,Books,£28.23,£28.23,£28.23,In stock (4 available),Nonfiction
The Gunning of America: Business and the Making of American Gun Culture,Books,£16.81,£16.81,£16.81,In stock (4 available),Nonfiction
The Hound of the Baskervilles (Sherlock Holmes #5),Books,£14.82,£14.82,£14.82,In stock (4 available),Classics
The Hunger Games (The Hunger Games #1),Books,£29.85,£29.85,£29.85,In stock (4 available),Default
Find Her (Detective D.D. Warren #8),Books,£22.37,£22.37,£22.37,In stock (5 available),Add a comment
The Jazz of Physics: The Secret Link Between Music and the Structure of the Universe,Books,£38.71,£38.71,£38.71,In stock (4 available),Nonfiction
The Passion of Dolssa,Books,£28.32,£28.32,£28.32,In stock (4 available),Historical Fiction
Some Women,Books,£13.73,£13.73,£13.73,In stock (4 available),Womens Fiction
The Beast (Black Dagger Brotherhood #14),Books,£46.08,£46.08,£46.08,In stock (4 available),Fantasy
The Bone Hunters (Lexy Vaughan & Steven Macaulay #2),Books,£59.71,£59.71,£59.71,In stock (4 available),Thriller
The Pilgrim's Progress,Books,£50.26,£50.26,£50.26,In stock (4 available),Classics
The Shining (The Shining #1),Books,£27.88,£27.88,£27.88,In stock (4 available),Default
The Perfect Play (Play by Play #1),Books,£59.99,£59.99,£59.99,In stock (4 available),Romance
Vogue Colors A to Z: A Fashion Coloring Book,Books,£52.35,£52.35,£52.35,In stock (4 available),Default
A Clash of Kings (A Song of Ice and Fire #2),Books,£10.79,£10.79,£10.79,In stock (5 available),Add a comment
A Feast for Crows (A Song of Ice and Fire #4),Books,£17.21,£17.21,£17.21,In stock (5 available),Fantasy
A Game of Thrones (A Song of Ice and Fire #1),Books,£46.42,£46.42,£46.42,In stock (5 available),Add a comment
A Girl's Guide to Moving On (New Beginnings #2),Books,£31.30,£31.30,£31.30,In stock (5 available),Romance
Alight (The Generations Trilogy #2),Books,£58.59,£58.59,£58.59,In stock (5 available),Default
Little Women (Little Women #1),Books,£28.07,£28.07,£28.07,In stock (4 available),Classics
Misery,Books,£34.79,£34.79,£34.79,In stock (4 available),Horror
Mockingjay (The Hunger Games #3),Books,£20.44,£20.44,£20.44,In stock (4 available),Default
Needful Things,Books,£47.51,£47.51,£47.51,In stock (4 available),Horror
Night Shift (Night Shift #1-20),Books,£12.75,£12.75,£12.75,In stock (4 available),Horror
No One Here Gets Out Alive,Books,£20.02,£20.02,£20.02,In stock (4 available),Music
"Orchestra of Exiles: The Story of Bronislaw Huberman, the Israel Philharmonic, and the One Thousand Jews He Saved from Nazi Horrors",Books,£12.36,£12.36,£12.36,In stock (4 available),Music
Outlander (Outlander #1),Books,£19.67,£19.67,£19.67,In stock (4 available),Default
Paper and Fire (The Great Library #2),Books,£49.45,£49.45,£49.45,In stock (4 available),Fantasy
Girl With a Pearl Earring,Books,£26.77,£26.77,£26.77,In stock (4 available),Historical Fiction
"Fruits Basket, Vol. 4 (Fruits Basket #4)",Books,£50.44,£50.44,£50.44,In stock (4 available),Sequential Art
Gone with the Wind,Books,£32.49,£32.49,£32.49,In stock (4 available),Classics
God Is Not Great: How Religion Poisons Everything,Books,£27.80,£27.80,£27.80,In stock (4 available),Nonfiction
Harry Potter and the Chamber of Secrets (Harry Potter #2),Books,£14.74,£14.74,£14.74,In stock (4 available),Fantasy
Harry Potter and the Half-Blood Prince (Harry Potter #6),Books,£48.75,£48.75,£48.75,In stock (4 available),Fantasy
Harry Potter and the Order of the Phoenix (Harry Potter #5),Books,£31.63,£31.63,£31.63,In stock (4 available),Fantasy
Harry Potter and the Prisoner of Azkaban (Harry Potter #3),Books,£24.17,£24.17,£24.17,In stock (4 available),Young Adult
Harry Potter and the Sorcerer's Stone (Harry Potter #1),Books,£13.90,£13.90,£13.90,In stock (4 available),Default
It,Books,£25.01,£25.01,£25.01,In stock (4 available),Horror
Shopaholic Ties the Knot (Shopaholic #3),Books,£48.39,£48.39,£48.39,In stock (4 available),Womens Fiction
A New Earth: Awakening to Your Life's Purpose,Books,£55.65,£55.65,£55.65,In stock (4 available),Spirituality
'Salem's Lot,Books,£49.56,£49.56,£49.56,In stock (4 available),Horror
Zero History (Blue Ant #3),Books,£34.77,£34.77,£34.77,In stock (3 available),Default
Animal Farm,Books,£57.22,£57.22,£57.22,In stock (4 available),Classics
A Walk to Remember,Books,£56.43,£56.43,£56.43,In stock (4 available),Romance
Atlas Shrugged,Books,£26.58,£26.58,£26.58,In stock (4 available),Fiction
"A History of God: The 4,000-Year Quest of Judaism, Christianity, and Islam",Books,£27.62,£27.62,£27.62,In stock (4 available),Religion
Can You Keep a Secret?,Books,£21.94,£21.94,£21.94,In stock (4 available),Womens Fiction
World War Z: An Oral History of the Zombie War,Books,£21.80,£21.80,£21.80,In stock (3 available),Default
Wuthering Heights,Books,£17.73,£17.73,£17.73,In stock (3 available),Classics
Changing the Game (Play by Play #2),Books,£13.38,£13.38,£13.38,In stock (4 available),Romance
Candide,Books,£58.63,£58.63,£58.63,In stock (4 available),Classics
Confessions of a Shopaholic (Shopaholic #1),Books,£48.94,£48.94,£48.94,In stock (4 available),Default
Dark Lover (Black Dagger Brotherhood #1),Books,£12.87,£12.87,£12.87,In stock (4 available),Romance
Far From True (Promise Falls Trilogy #2),Books,£34.93,£34.93,£34.93,In stock (4 available),Thriller
"Where'd You Go, Bernadette",Books,£18.13,£18.13,£18.13,In stock (3 available),Default
We Are All Completely Beside Ourselves,Books,£24.04,£24.04,£24.04,In stock (3 available),Contemporary
Wild: From Lost to Found on the Pacific Crest Trail,Books,£46.02,£46.02,£46.02,In stock (3 available),Default
The Wild Robot,Books,£56.07,£56.07,£56.07,In stock (3 available),Childrens
The Tipping Point: How Little Things Can Make a Big Difference,Books,£10.02,£10.02,£10.02,In stock (3 available),Add a comment
The Undomestic Goddess,Books,£45.75,£45.75,£45.75,In stock (3 available),Womens Fiction
"Thinking, Fast and Slow",Books,£21.14,£21.14,£21.14,In stock (3 available),Psychology
"The Wicked + The Divine, Vol. 3: Commercial Suicide (The Wicked + The Divine)",Books,£14.41,£14.41,£14.41,In stock (3 available),Sequential Art
We the People: The Modern-Day Figures Who Have Reshaped and Affirmed the Founding Fathers' Vision of America,Books,£31.95,£31.95,£31.95,In stock (3 available),Nonfiction
Three-Martini Lunch,Books,£23.21,£23.21,£23.21,In stock (3 available),Fiction
The Travelers,Books,£15.77,£15.77,£15.77,In stock (3 available),Thriller
"Trespassing Across America: One Man's Epic, Never-Done-Before (and Sort of Illegal) Hike Across the Heartland",Books,£53.51,£53.51,£53.51,In stock (3 available),Nonfiction
Twilight (Twilight #1),Books,£41.93,£41.93,£41.93,In stock (3 available),Default
Twenties Girl,Books,£42.80,£42.80,£42.80,In stock (3 available),Womens Fiction
Two Boys Kissing,Books,£32.74,£32.74,£32.74,In stock (3 available),Young Adult
When You Are Engulfed in Flames,Books,£30.89,£30.89,£30.89,In stock (3 available),Humor
"Unstuffed: Decluttering Your Home, Mind, and Soul",Books,£58.09,£58.09,£58.09,In stock (3 available),Nonfiction
The Smitten Kitchen Cookbook,Books,£23.59,£23.59,£23.59,In stock (3 available),Food and Drink
Vegan Vegetarian Omnivore: Dinner for Everyone at the Table,Books,£13.66,£13.66,£13.66,In stock (3 available),Food and Drink
The Stand,Books,£57.86,£57.86,£57.86,In stock (3 available),Horror
Under the Banner of Heaven: A Story of Violent Faith,Books,£30.00,£30.00,£30.00,In stock (3 available),Nonfiction
Voyager (Outlander #3),Books,£21.07,£21.07,£21.07,In stock (3 available),Historical Fiction
Walk the Edge (Thunder Road #2),Books,£32.36,£32.36,£32.36,In stock (3 available),Young Adult
Very Good Lives: The Fringe Benefits of Failure and the Importance of Imagination,Books,£50.66,£50.66,£50.66,In stock (3 available),Nonfiction
The Obsession,Books,£45.43,£45.43,£45.43,In stock (3 available),Romance
The Paris Wife,Books,£36.80,£36.80,£36.80,In stock (3 available),Default
The Nanny Diaries (Nanny #1),Books,£52.53,£52.53,£52.53,In stock (3 available),Womens Fiction
The Nightingale,Books,£26.26,£26.26,£26.26,In stock (3 available),Fiction
The Purest Hook (Second Circle Tattoos #3),Books,£12.25,£12.25,£12.25,In stock (3 available),Romance
The Purpose Driven Life: What on Earth Am I Here for?,Books,£37.19,£37.19,£37.19,In stock (3 available),Add a comment
The Name of God is Mercy,Books,£37.25,£37.25,£37.25,In stock (3 available),Nonfiction
The Rest Is Noise: Listening to the Twentieth Century,Books,£34.77,£34.77,£34.77,In stock (3 available),Add a comment
The New Guy (and Other Senior Year Distractions),Books,£44.92,£44.92,£44.92,In stock (3 available),Young Adult
The Picture of Dorian Gray,Books,£29.70,£29.70,£29.70,In stock (3 available),Classics
The Red Tent,Books,£35.66,£35.66,£35.66,In stock (3 available),Historical Fiction
The Restaurant at the End of the Universe (Hitchhiker's Guide to the Galaxy #2),Books,£10.92,£10.92,£10.92,In stock (3 available),Science Fiction
The Rise of Theodore Roosevelt (Theodore Roosevelt #1),Books,£42.57,£42.57,£42.57,In stock (3 available),Biography
The Road to Little Dribbling: Adventures of an American in Britain (Notes From a Small Island #2),Books,£23.21,£23.21,£23.21,In stock (3 available),Travel
