name,product_type,price,price_excl_tax,price_incl_tax,Availability,catagory
The Boys in the Boat: Nine Americans and Their Epic Quest for Gold at the 1936 Berlin Olympics,Books,£22.60,£22.60,£22.60,In stock (19 available),Default
A Light in the Attic,Books,£51.77,£51.77,£51.77,In stock (22 available),Poetry
"The Coming Woman: A Novel Based on the Life of the Infamous Feminist, Victoria Woodhull",Books,£17.93,£17.93,£17.93,In stock (19 available),Default
Soumission,Books,£50.10,£50.10,£50.10,In stock (20 available),Fiction
Sharp Objects,Books,£47.82,£47.82,£47.82,In stock (20 available),Mystery
The Requiem Red,Books,£22.65,£22.65,£22.65,In stock (19 available),Young Adult
Sapiens: A Brief History of Humankind,Books,£54.23,£54.23,£54.23,In stock (20 available),History
The Dirty Little Secrets of Getting Your Dream Job,Books,£33.34,£33.34,£33.34,In stock (19 available),Business
Tipping the Velvet,Books,£53.74,£53.74,£53.74,In stock (20 available),Historical Fiction
Mesaerion: The Best Science Fiction Stories 1800-1849,Books,£37.59,£37.59,£37.59,In stock (19 available),Science Fiction
"Our Band Could Be Your Life: Scenes from the American Indie Underground, 1981-1991",Books,£57.25,£57.25,£57.25,In stock (19 available),Music
Rip it Up and Start Again,Books,£35.02,£35.02,£35.02,In stock (19 available),Music
Scott Pilgrim's Precious Little Life (Scott Pilgrim #1),Books,£52.29,£52.29,£52.29,In stock (19 available),Sequential Art
It's Only the Himalayas,Books,£45.17,£45.17,£45.17,In stock (19 available),Travel
Libertarianism for Beginners,Books,£51.33,£51.33,£51.33,In stock (19 available),Politics
Olio,Books,£23.88,£23.88,£23.88,In stock (19 available),Poetry
Shakespeare's Sonnets,Books,£20.66,£20.66,£20.66,In stock (19 available),Poetry
"Starving Hearts (Triangular Trade Trilogy, #1)",Books,£13.99,£13.99,£13.99,In stock (19 available),Default
The Black Maria,Books,£52.15,£52.15,£52.15,In stock (19 available),Poetry
Set Me Free,Books,£17.46,£17.46,£17.46,In stock (19 available),Young Adult
The Four Agreements: A Practical Guide to Personal Freedom,Books,£17.66,£17.66,£17.66,In stock (18 available),Spirituality
You can't bury them all: Poems,Books,£33.63,£33.63,£33.63,In stock (17 available),Poetry
Sophie's World,Books,£15.94,£15.94,£15.94,In stock (18 available),Philosophy
The Bear and the Piano,Books,£36.89,£36.89,£36.89,In stock (18 available),Childrens
The Elephant Tree,Books,£23.82,£23.82,£23.82,In stock (18 available),Thriller
The Five Love Languages: How to Express Heartfelt Commitment to Your Mate,Books,£31.05,£31.05,£31.05,In stock (18 available),Nonfiction
"In a Dark, Dark Wood",Books,£19.63,£19.63,£19.63,In stock (18 available),Mystery
Maude (1883-1993):She Grew Up with the country,Books,£18.02,£18.02,£18.02,In stock (18 available),Default
Penny Maybe,Books,£33.29,£33.29,£33.29,In stock (18 available),Default
Behind Closed Doors,Books,£52.22,£52.22,£52.22,In stock (18 available),Thriller
America's Cradle of Quarterbacks: Western Pennsylvania's Football Factory from Johnny Unitas to Joe Montana,Books,£22.50,£22.50,£22.50,In stock (19 available),Default
Birdsong: A Story in Pictures,Books,£54.64,£54.64,£54.64,In stock (19 available),Childrens
Black Dust,Books,£34.53,£34.53,£34.53,In stock (19 available),Romance
Chase Me (Paris Nights #2),Books,£25.27,£25.27,£25.27,In stock (19 available),Romance
Wall and Piece,Books,£44.18,£44.18,£44.18,In stock (18 available),Art
Worlds Elsewhere: Journeys Around Shakespeare’s Globe,Books,£40.30,£40.30,£40.30,In stock (18 available),Nonfiction
Aladdin and His Wonderful Lamp,Books,£53.13,£53.13,£53.13,In stock (19 available),Default
How Music Works,Books,£37.32,£37.32,£37.32,In stock (19 available),Music
In Her Wake,Books,£12.84,£12.84,£12.84,In stock (19 available),Thriller
The Secret of Dreadwillow Carse,Books,£56.13,£56.13,£56.13,In stock (16 available),Childrens
"Foolproof Preserving: A Guide to Small Batch Jams, Jellies, Pickles, Condiments, and More: A Foolproof Guide to Making Small Batch Jams, Jellies, Pickles, Condiments, and More",Books,£30.52,£30.52,£30.52,In stock (19 available),Food and Drink
The Torch Is Passed: A Harding Family Story,Books,£19.09,£19.09,£19.09,In stock (16 available),Add a comment
Tsubasa: WoRLD CHRoNiCLE 2 (Tsubasa WoRLD CHRoNiCLE #2),Books,£16.28,£16.28,£16.28,In stock (16 available),Sequential Art
The Natural History of Us (The Fine Art of Pretending #2),Books,£45.22,£45.22,£45.22,In stock (16 available),Young Adult
"The Pioneer Woman Cooks: Dinnertime: Comfort Classics, Freezer Food, 16-Minute Meals, and Other Delicious Ways to Solve Supper!",Books,£56.41,£56.41,£56.41,In stock (16 available),Food and Drink
Thirst,Books,£17.27,£17.27,£17.27,In stock (16 available),Fiction
This One Summer,Books,£19.49,£19.49,£19.49,In stock (16 available),Sequential Art
Throwing Rocks at the Google Bus: How Growth Became the Enemy of Prosperity,Books,£31.12,£31.12,£31.12,In stock (16 available),Nonfiction
"Unbound: How Eight Technologies Made Us Human, Transformed Society, and Brought Our World to the Brink",Books,£25.52,£25.52,£25.52,In stock (16 available),History
Unicorn Tracks,Books,£18.78,£18.78,£18.78,In stock (16 available),Fantasy
"Unseen City: The Majesty of Pigeons, the Discreet Charm of Snails & Other Wonders of the Urban Wilderness",Books,£44.18,£44.18,£44.18,In stock (16 available),Nonfiction
The Past Never Ends,Books,£56.50,£56.50,£56.50,In stock (16 available),Mystery
Untitled Collection: Sabbath Poems 2014,Books,£14.27,£14.27,£14.27,In stock (16 available),Poetry
#HigherSelfie: Wake Up Your Life. Free Your Soul. Find Your Tribe.,Books,£23.11,£23.11,£23.11,In stock (17 available),Nonfiction
Private Paris (Private #10),Books,£47.61,£47.61,£47.61,In stock (17 available),Fiction
Reasons to Stay Alive,Books,£26.41,£26.41,£26.41,In stock (17 available),Nonfiction
The Activist's Tao Te Ching: Ancient Advice for a Modern Revolution,Books,£32.24,£32.24,£32.24,In stock (16 available),Spirituality
"We Love You, Charlie Freeman",Books,£50.27,£50.27,£50.27,In stock (16 available),Fiction
When We Collided,Books,£31.77,£31.77,£31.77,In stock (16 available),Contemporary
Without Borders (Wanderlove #1),Books,£45.07,£45.07,£45.07,In stock (16 available),New Adult
"Rat Queens, Vol. 3: Demons (Rat Queens (Collected Editions) #11-15)",Books,£50.40,£50.40,£50.40,In stock (16 available),Sequential Art
Reskilling America: Learning to Labor in the Twenty-First Century,Books,£19.83,£19.83,£19.83,In stock (16 available),Nonfiction
Slow States of Collapse: Poems,Books,£57.31,£57.31,£57.31,In stock (17 available),Poetry
"Saga, Volume 5 (Saga (Collected Editions) #5)",Books,£51.04,£51.04,£51.04,In stock (16 available),Sequential Art
"Saga, Volume 6 (Saga (Collected Editions) #6)",Books,£25.02,£25.02,£25.02,In stock (16 available),Fantasy
Spark Joy: An Illustrated Master Class on the Art of Organizing and Tidying Up,Books,£41.83,£41.83,£41.83,In stock (16 available),Nonfiction
The Age of Genius: The Seventeenth Century and the Birth of the Modern Mind,Books,£19.73,£19.73,£19.73,In stock (16 available),History
"The Bulletproof Diet: Lose up to a Pound a Day, Reclaim Energy and Focus, Upgrade Your Life",Books,£49.05,£49.05,£49.05,In stock (16 available),Health
Security,Books,£39.25,£39.25,£39.25,In stock (16 available),Horror
The Death of Humanity: and the Case for Life,Books,£58.11,£58.11,£58.11,In stock (16 available),Philosophy
Soul Reader,Books,£39.58,£39.58,£39.58,In stock (16 available),Default
The Electric Pencil: Drawings from Inside State Hospital No. 3,Books,£56.06,£56.06,£56.06,In stock (16 available),Nonfiction
The Gutsy Girl: Escapades for Your Life of Epic Adventure,Books,£37.13,£37.13,£37.13,In stock (16 available),Nonfiction
The Art Forger,Books,£40.76,£40.76,£40.76,In stock (16 available),Add a comment
"The Inefficiency Assassin: Time Management Tactics for Working Smarter, Not Longer",Books,£20.59,£20.59,£20.59,In stock (16 available),Default
The Life-Changing Magic of Tidying Up: The Japanese Art of Decluttering and Organizing,Books,£16.77,£16.77,£16.77,In stock (16 available),Nonfiction
The Most Perfect Thing: Inside (and Outside) a Bird's Egg,Books,£42.96,£42.96,£42.96,In stock (16 available),Science
The Nameless City (The Nameless City #1),Books,£38.16,£38.16,£38.16,In stock (16 available),Sequential Art
My Paris Kitchen: Recipes and Stories,Books,£33.37,£33.37,£33.37,In stock (16 available),Food and Drink
On a Midnight Clear,Books,£14.07,£14.07,£14.07,In stock (16 available),Add a comment
Online Marketing for Busy Authors: A Step-By-Step Guide,Books,£46.35,£46.35,£46.35,In stock (16 available),Self Help
"The Mindfulness and Acceptance Workbook for Anxiety: A Guide to Breaking Free from Anxiety, Phobias, and Worry Using Acceptance and Commitment Therapy",Books,£23.89,£23.89,£23.89,In stock (16 available),Add a comment
The Murder That Never Was (Forensic Instincts #5),Books,£54.11,£54.11,£54.11,In stock (16 available),Fiction
In the Country We Love: My Family Divided,Books,£22.00,£22.00,£22.00,In stock (16 available),Nonfiction
Join,Books,£35.67,£35.67,£35.67,In stock (16 available),Science Fiction
Obsidian (Lux #1),Books,£14.86,£14.86,£14.86,In stock (16 available),Young Adult
Judo: Seven Steps to Black Belt (an Introductory Guide for Beginners),Books,£53.90,£53.90,£53.90,In stock (16 available),Add a comment
"Layered: Baking, Building, and Styling Spectacular Cakes",Books,£40.11,£40.11,£40.11,In stock (16 available),Food and Drink
Lumberjanes Vol. 3: A Terrible Plan (Lumberjanes #9-12),Books,£19.92,£19.92,£19.92,In stock (16 available),Sequential Art
"Lumberjanes, Vol. 1: Beware the Kitten Holy (Lumberjanes #1-4)",Books,£45.61,£45.61,£45.61,In stock (16 available),Sequential Art
"Lumberjanes, Vol. 2: Friendship to the Max (Lumberjanes #5-8)",Books,£46.91,£46.91,£46.91,In stock (16 available),Sequential Art
"Mama Tried: Traditional Italian Cooking for the Screwed, Crude, Vegan, and Tattooed",Books,£14.02,£14.02,£14.02,In stock (16 available),Food and Drink
Masks and Shadows,Books,£56.40,£56.40,£56.40,In stock (16 available),Fantasy
orange: The Complete Collection 1 (orange: The Complete Collection #1),Books,£48.41,£48.41,£48.41,In stock (16 available),Sequential Art
"Outcast, Vol. 1: A Darkness Surrounds Him (Outcast #1)",Books,£15.44,£15.44,£15.44,In stock (16 available),Sequential Art
Patience,Books,£10.16,£10.16,£10.16,In stock (16 available),Sequential Art
"Pop Gun War, Volume 1: Gift",Books,£18.97,£18.97,£18.97,In stock (16 available),Sequential Art
Princess Between Worlds (Wide-Awake Princess #5),Books,£13.34,£13.34,£13.34,In stock (16 available),Fantasy
"Princess Jellyfish 2-in-1 Omnibus, Vol. 01 (Princess Jellyfish 2-in-1 Omnibus #1)",Books,£13.61,£13.61,£13.61,In stock (16 available),Sequential Art
"Political Suicide: Missteps, Peccadilloes, Bad Calls, Backroom Hijinx, Sordid Pasts, Rotten Breaks, and Just Plain Dumb Mistakes in the Annals of American Politics",Books,£36.28,£36.28,£36.28,In stock (16 available),History
Crown of Midnight (Throne of Glass #2),Books,£43.29,£43.29,£43.29,In stock (16 available),Fantasy
Camp Midnight,Books,£17.08,£17.08,£17.08,In stock (16 available),Sequential Art
Burning,Books,£28.81,£28.81,£28.81,In stock (16 available),Young Adult
Danganronpa Volume 1,Books,£51.99,£51.99,£51.99,In stock (16 available),Sequential Art
Call the Nurse: True Stories of a Country Nurse on a Scottish Isle,Books,£29.14,£29.14,£29.14,In stock (16 available),Nonfiction
"Don't Be a Jerk: And Other Practical Advice from Dogen, Japan's Greatest Zen Master",Books,£37.97,£37.97,£37.97,In stock (16 available),Religion
Everydata: The Misinformation Hidden in the Little Data You Consume Every Day,Books,£54.35,£54.35,£54.35,In stock (16 available),Nonfiction
"Codename Baboushka, Volume 1: The Conclave of Death",Books,£36.72,£36.72,£36.72,In stock (16 available),Sequential Art
Fifty Shades Darker (Fifty Shades #2),Books,£21.96,£21.96,£21.96,In stock (16 available),Romance
First and First (Five Boroughs #3),Books,£15.97,£15.97,£15.97,In stock (16 available),Romance
Forever and Forever: The Courtship of Henry Longfellow and Fanny Appleton,Books,£29.69,£29.69,£29.69,In stock (16 available),Historical Fiction
"Giant Days, Vol. 2 (Giant Days #5-8)",Books,£22.11,£22.11,£22.11,In stock (16 available),Sequential Art
Her Backup Boyfriend (The Sorensen Family #1),Books,£33.97,£33.97,£33.97,In stock (16 available),Romance
How to Be Miserable: 40 Strategies You Already Use,Books,£46.03,£46.03,£46.03,In stock (16 available),Self Help
"Avatar: The Last Airbender: Smoke and Shadow, Part 3 (Smoke and Shadow #3)",Books,£28.09,£28.09,£28.09,In stock (16 available),Fantasy
"Bitch Planet, Vol. 1: Extraordinary Machine (Bitch Planet (Collected Editions))",Books,£37.92,£37.92,£37.92,In stock (16 available),Sequential Art
Bossypants,Books,£49.46,£49.46,£49.46,In stock (16 available),Default
"I Hate Fairyland, Vol. 1: Madly Ever After (I Hate Fairyland (Compilations) #1-5)",Books,£29.17,£29.17,£29.17,In stock (16 available),Sequential Art
I am a Hero Omnibus Volume 1,Books,£54.63,£54.63,£54.63,In stock (16 available),Sequential Art
Immunity: How Elie Metchnikoff Changed the Course of Modern Medicine,Books,£57.36,£57.36,£57.36,In stock (16 available),Science
Tracing Numbers on a Train,Books,£41.60,£41.60,£41.60,In stock (15 available),Default
A Court of Thorns and Roses (A Court of Thorns and Roses #1),Books,£52.37,£52.37,£52.37,In stock (16 available),Fantasy
"William Shakespeare's Star Wars: Verily, A New Hope (William Shakespeare's Star Wars #4)",Books,£43.30,£43.30,£43.30,In stock (15 available),Science Fiction
You Are What You Love: The Spiritual Power of Habit,Books,£21.87,£21.87,£21.87,In stock (15 available),Religion
Tuesday Nights in 1980,Books,£21.04,£21.04,£21.04,In stock (15 available),Fiction
Throne of Glass (Throne of Glass #1),Books,£35.07,£35.07,£35.07,In stock (15 available),Fantasy
A Fierce and Subtle Poison,Books,£28.13,£28.13,£28.13,In stock (16 available),Young Adult
A Flight of Arrows (The Pathfinders #2),Books,£55.53,£55.53,£55.53,In stock (16 available),Historical Fiction
A Murder in Time,Books,£16.64,£16.64,£16.64,In stock (16 available),Mystery
"A Piece of Sky, a Grain of Rice: A Memoir in Four Meditations",Books,£56.76,£56.76,£56.76,In stock (16 available),Default
Thomas Jefferson and the Tripoli Pirates: The Forgotten War That Changed American History,Books,£59.64,£59.64,£59.64,In stock (15 available),History
(Un)Qualified: How God Uses Broken People to Do Big Things,Books,£54.00,£54.00,£54.00,In stock (16 available),Christian
A World of Flavor: Your Gluten Free Passport,Books,£42.95,£42.95,£42.95,In stock (16 available),Default
Algorithms to Live By: The Computer Science of Human Decisions,Books,£30.81,£30.81,£30.81,In stock (16 available),Nonfiction
The Stranger,Books,£17.44,£17.44,£17.44,In stock (15 available),Philosophy
The Third Wave: An Entrepreneur’s Vision of the Future,Books,£12.61,£12.61,£12.61,In stock (15 available),Business
The Vacationers,Books,£42.15,£42.15,£42.15,In stock (15 available),Fiction
The Wedding Dress,Books,£24.12,£24.12,£24.12,In stock (15 available),Romance
The White Cat and the Monk: A Retelling of the Poem “Pangur Bán”,Books,£58.08,£58.08,£58.08,In stock (15 available),Childrens
Thirteen Reasons Why,Books,£52.72,£52.72,£52.72,In stock (15 available),Default
The Love and Lemons Cookbook: An Apple-to-Zucchini Celebration of Impromptu Cooking,Books,£37.60,£37.60,£37.60,In stock (15 available),Food and Drink
The Girl on the Train,Books,£55.02,£55.02,£55.02,In stock (15 available),Default
The Glittering Court (The Glittering Court #1),Books,£44.28,£44.28,£44.28,In stock (15 available),Fantasy
The Kite Runner,Books,£41.82,£41.82,£41.82,In stock (15 available),Default
The Long Shadow of Small Ghosts: Murder and Memory in an American City,Books,£10.97,£10.97,£10.97,In stock (15 available),Crime
The Genius of Birds,Books,£17.24,£17.24,£17.24,In stock (15 available),Nonfiction
The Emerald Mystery,Books,£23.15,£23.15,£23.15,In stock (15 available),Default
The Matchmaker's Playbook (Wingmen Inc. #1),Books,£55.85,£55.85,£55.85,In stock (15 available),New Adult
The House by the Lake,Books,£36.95,£36.95,£36.95,In stock (15 available),Historical Fiction
The Mistake (Off-Campus #2),Books,£43.29,£43.29,£43.29,In stock (15 available),New Adult
The Murder of Roger Ackroyd (Hercule Poirot #4),Books,£44.10,£44.10,£44.10,In stock (15 available),Mystery
The Nerdy Nummies Cookbook: Sweet Treats for the Geek in All of Us,Books,£37.34,£37.34,£37.34,In stock (15 available),Food and Drink
The Power of Now: A Guide to Spiritual Enlightenment,Books,£43.54,£43.54,£43.54,In stock (15 available),Nonfiction
The Psychopath Test: A Journey Through the Madness Industry,Books,£36.00,£36.00,£36.00,In stock (15 available),Default
The Project,Books,£10.65,£10.65,£10.65,In stock (15 available),Science Fiction
The Cookies & Cups Cookbook: 125+ sweet & savory recipes reminding you to Always Eat Dessert First,Books,£41.25,£41.25,£41.25,In stock (15 available),Food and Drink
The Regional Office Is Under Attack!,Books,£51.36,£51.36,£51.36,In stock (15 available),Fiction
The Secret (The Secret #1),Books,£27.37,£27.37,£27.37,In stock (15 available),Default
The Omnivore's Dilemma: A Natural History of Four Meals,Books,£38.21,£38.21,£38.21,In stock (15 available),Nonfiction
The Shadow Hero (The Shadow Hero),Books,£33.14,£33.14,£33.14,In stock (15 available),Sequential Art
Secrets and Lace (Fatal Hearts #1),Books,£20.27,£20.27,£20.27,In stock (15 available),Default
Poses for Artists Volume 1 - Dynamic and Sitting Poses: An Essential Reference for Figure Drawing and the Human Form,Books,£41.06,£41.06,£41.06,In stock (15 available),Default
"Shobu Samurai, Project Aryoku (#3)",Books,£29.06,£29.06,£29.06,In stock (15 available),Add a comment
Redeeming Love,Books,£20.47,£20.47,£20.47,In stock (15 available),Christian Fiction
Shoe Dog: A Memoir by the Creator of NIKE,Books,£23.99,£23.99,£23.99,In stock (15 available),Business
Scarlett Epstein Hates It Here,Books,£43.55,£43.55,£43.55,In stock (15 available),Young Adult
Poems That Make Grown Women Cry,Books,£14.19,£14.19,£14.19,In stock (15 available),Poetry
So You've Been Publicly Shamed,Books,£12.23,£12.23,£12.23,In stock (15 available),Nonfiction
Soft Apocalypse,Books,£26.12,£26.12,£26.12,In stock (15 available),Science Fiction
Something More Than This,Books,£16.24,£16.24,£16.24,In stock (15 available),Romance
Suddenly in Love (Lake Haven #1),Books,£55.99,£55.99,£55.99,In stock (15 available),Romance
The 10% Entrepreneur: Live Your Startup Dream Without Quitting Your Day Job,Books,£27.55,£27.55,£27.55,In stock (15 available),Business
The Argonauts,Books,£10.93,£10.93,£10.93,In stock (15 available),Autobiography
The Artist's Way: A Spiritual Path to Higher Creativity,Books,£38.49,£38.49,£38.49,In stock (15 available),Nonfiction
The Art of War,Books,£33.34,£33.34,£33.34,In stock (15 available),Default
Night Sky with Exit Wounds,Books,£41.05,£41.05,£41.05,In stock (15 available),Poetry
Mrs. Houdini,Books,£30.25,£30.25,£30.25,In stock (15 available),Historical Fiction
Grumbles,Books,£22.16,£22.16,£22.16,In stock (15 available),Default
Frostbite (Vampire Academy #2),Books,£29.99,£29.99,£29.99,In stock (15 available),Young Adult
First Steps for New Christians (Print Edition),Books,£29.00,£29.00,£29.00,In stock (15 available),Default
Follow You Home,Books,£21.36,£21.36,£21.36,In stock (15 available),Horror
Hollow City (Miss Peregrine’s Peculiar Children #2),Books,£42.98,£42.98,£42.98,In stock (15 available),Fantasy
Full Moon over Noah’s Ark: An Odyssey to Mount Ararat and Beyond,Books,£49.43,£49.43,£49.43,In stock (15 available),Travel
Romero and Juliet: A Tragic Tale of Love and Zombies,Books,£36.94,£36.94,£36.94,In stock (15 available),Default
I Had a Nice Time And Other Lies...: How to find love & sh*t like that,Books,£57.36,£57.36,£57.36,In stock (15 available),Womens Fiction
Large Print Heart of the Pride,Books,£19.15,£19.15,£19.15,In stock (15 available),Default
Library of Souls (Miss Peregrine’s Peculiar Children #3),Books,£48.56,£48.56,£48.56,In stock (15 available),Young Adult
Louisa: The Extraordinary Life of Mrs. Adams,Books,£16.85,£16.85,£16.85,In stock (15 available),Biography
Little Red,Books,£13.47,£13.47,£13.47,In stock (15 available),Childrens
Modern Romance,Books,£28.26,£28.26,£28.26,In stock (15 available),Add a comment
The Bridge to Consciousness: I'm Writing the Bridge Between Science and Our Old and New Beliefs.,Books,£32.00,£32.00,£32.00,In stock (15 available),Default
"Nightingale, Sing",Books,£38.28,£38.28,£38.28,In stock (15 available),Young Adult
"Deliciously Ella Every Day: Quick and Easy Recipes for Gluten-Free Snacks, Packed Lunches, and Simple Meals",Books,£42.16,£42.16,£42.16,In stock (15 available),Food and Drink
Doing It Over (Most Likely To #1),Books,£35.61,£35.61,£35.61,In stock (15 available),Romance
Done Rubbed Out (Reightman & Bailey #1),Books,£37.72,£37.72,£37.72,In stock (15 available),Default
Drive: The Surprising Truth About What Motivates Us,Books,£34.95,£34.95,£34.95,In stock (15 available),Default
Eureka Trivia 6.0,Books,£54.59,£54.59,£54.59,In stock (15 available),Default
Finders Keepers (Bill Hodges Trilogy #2),Books,£53.53,£53.53,£53.53,In stock (15 available),Fiction
Miss Peregrine’s Home for Peculiar Children (Miss Peregrine’s Peculiar Children #1),Books,£10.76,£10.76,£10.76,In stock (15 available),Default
Amatus,Books,£50.54,£50.54,£50.54,In stock (15 available),Default
Ayumi's Violin,Books,£15.48,£15.48,£15.48,In stock (15 available),Default
Batman: The Dark Knight Returns (Batman),Books,£15.38,£15.38,£15.38,In stock (15 available),Sequential Art
Amy Meets the Saints and Sages,Books,£18.46,£18.46,£18.46,In stock (15 available),Default
Batman: The Long Halloween (Batman),Books,£36.50,£36.50,£36.50,In stock (15 available),Sequential Art
"Fables, Vol. 1: Legends in Exile (Fables #1)",Books,£41.62,£41.62,£41.62,In stock (15 available),Sequential Art
Beauty Restored (Riley Family Legacy Novellas #3),Books,£11.11,£11.11,£11.11,In stock (15 available),Default
Amid the Chaos,Books,£36.58,£36.58,£36.58,In stock (15 available),Cultural
Becoming Wise: An Inquiry into the Mystery and Art of Living,Books,£27.43,£27.43,£27.43,In stock (15 available),Nonfiction
Anonymous,Books,£46.82,£46.82,£46.82,In stock (15 available),Default
Big Magic: Creative Living Beyond Fear,Books,£30.80,£30.80,£30.80,In stock (15 available),Nonfiction
Chasing Heaven: What Dying Taught Me About Living,Books,£37.80,£37.80,£37.80,In stock (15 available),Spirituality
Close to You,Books,£49.46,£49.46,£49.46,In stock (15 available),Christian Fiction
"Daring Greatly: How the Courage to Be Vulnerable Transforms the Way We Live, Love, Parent, and Lead",Books,£19.43,£19.43,£19.43,In stock (15 available),Nonfiction
Dark Notes,Books,£19.19,£19.19,£19.19,In stock (15 available),Erotica
Why the Right Went Wrong: Conservatism--From Goldwater to the Tea Party and Beyond,Books,£52.65,£52.65,£52.65,In stock (14 available),Politics
"Wonder Woman: Earth One, Volume One (Wonder Woman: Earth One #1)",Books,£37.34,£37.34,£37.34,In stock (14 available),Sequential Art
You (You #1),Books,£43.61,£43.61,£43.61,In stock (14 available),Thriller
Zealot: The Life and Times of Jesus of Nazareth,Books,£24.70,£24.70,£24.70,In stock (14 available),History
Wild Swans,Books,£14.36,£14.36,£14.36,In stock (14 available),Young Adult
Agnostic: A Spirited Manifesto,Books,£12.51,£12.51,£12.51,In stock (15 available),Nonfiction
The Year of Magical Thinking,Books,£43.04,£43.04,£43.04,In stock (14 available),Nonfiction
This Is Where It Ends,Books,£27.12,£27.12,£27.12,In stock (14 available),Young Adult
V for Vendetta (V for Vendetta Complete),Books,£37.10,£37.10,£37.10,In stock (14 available),Default
Twenty Yawns,Books,£22.08,£22.08,£22.08,In stock (14 available),Childrens
Walt Disney's Alice in Wonderland,Books,£12.96,£12.96,£12.96,In stock (14 available),Childrens
Through the Woods,Books,£25.38,£25.38,£25.38,In stock (14 available),Sequential Art
"We Are Robin, Vol. 1: The Vigilante Business (We Are Robin #1)",Books,£53.90,£53.90,£53.90,In stock (14 available),Sequential Art
"Unbroken: A World War II Story of Survival, Resilience, and Redemption",Books,£45.95,£45.95,£45.95,In stock (14 available),Default
What's It Like in Space?: Stories from Astronauts Who've Been There,Books,£19.60,£19.60,£19.60,In stock (14 available),Nonfiction
Until Friday Night (The Field Party #1),Books,£46.31,£46.31,£46.31,In stock (14 available),Young Adult
Whole Lotta Creativity Going On: 60 Fun and Unusual Exercises to Awaken and Strengthen Your Creativity,Books,£38.20,£38.20,£38.20,In stock (14 available),Nonfiction
The Rosie Project (Don Tillman #1),Books,£54.04,£54.04,£54.04,In stock (14 available),Default
The Song of Achilles,Books,£37.40,£37.40,£37.40,In stock (14 available),Add a comment
The Songs of the Gods,Books,£44.48,£44.48,£44.48,In stock (14 available),Default
The Star-Touched Queen,Books,£46.02,£46.02,£46.02,In stock (14 available),Fantasy
The Testament of Mary,Books,£52.67,£52.67,£52.67,In stock (14 available),Fiction
The Wedding Pact (The O'Malleys #2),Books,£32.61,£32.61,£32.61,In stock (14 available),Romance
