name,product_type,price,price_excl_tax,price_incl_tax,Availability,catagory
The Time Keeper,Books,£27.88,£27.88,£27.88,In stock (14 available),Fiction
The White Queen (The Cousins' War #1),Books,£25.91,£25.91,£25.91,In stock (14 available),Add a comment
The Wright Brothers,Books,£56.80,£56.80,£56.80,In stock (14 available),Default
The Long Haul (Diary of a Wimpy Kid #9),Books,£44.07,£44.07,£44.07,In stock (14 available),Humor
The Power of Habit: Why We Do What We Do in Life and Business,Books,£16.88,£16.88,£16.88,In stock (14 available),Default
The Lucifer Effect: Understanding How Good People Turn Evil,Books,£10.40,£10.40,£10.40,In stock (14 available),Psychology
The Marriage of Opposites,Books,£28.08,£28.08,£28.08,In stock (14 available),Historical Fiction
The Bad-Ass Librarians of Timbuktu: And Their Race to Save the World’s Most Precious Manuscripts,Books,£15.77,£15.77,£15.77,In stock (14 available),Nonfiction
The Darkest Lie,Books,£35.35,£35.35,£35.35,In stock (14 available),Young Adult
The Bane Chronicles (The Bane Chronicles #1-11),Books,£44.73,£44.73,£44.73,In stock (14 available),Fantasy
The Dovekeepers,Books,£48.78,£48.78,£48.78,In stock (14 available),Add a comment
The First Hostage (J.B. Collins #2),Books,£25.85,£25.85,£25.85,In stock (14 available),Fiction
The Guilty (Will Robie #4),Books,£13.82,£13.82,£13.82,In stock (14 available),Thriller
The Help Yourself Cookbook for Kids: 60 Easy Plant-Based Recipes Kids Can Make to Stay Healthy and Save the Earth,Books,£28.77,£28.77,£28.77,In stock (14 available),Food and Drink
The Hidden Oracle (The Trials of Apollo #1),Books,£52.26,£52.26,£52.26,In stock (14 available),Fantasy
The Immortal Life of Henrietta Lacks,Books,£40.67,£40.67,£40.67,In stock (14 available),Add a comment
The Literature Book (Big Ideas Simply Explained),Books,£17.43,£17.43,£17.43,In stock (14 available),Nonfiction
The Last Mile (Amos Decker #2),Books,£54.21,£54.21,£54.21,In stock (14 available),Mystery
Take Me with You,Books,£45.21,£45.21,£45.21,In stock (14 available),Fiction
Tastes Like Fear (DI Marnie Rome #3),Books,£10.69,£10.69,£10.69,In stock (14 available),Mystery
That Darkness (Gardiner and Renner #1),Books,£13.92,£13.92,£13.92,In stock (14 available),Mystery
The 14th Colony (Cotton Malone #11),Books,£39.24,£39.24,£39.24,In stock (14 available),Thriller
The Loney,Books,£23.40,£23.40,£23.40,In stock (14 available),Horror
Once Was a Time,Books,£18.28,£18.28,£18.28,In stock (14 available),Childrens
Rain Fish,Books,£23.57,£23.57,£23.57,In stock (14 available),Childrens
"Red Hood/Arsenal, Vol. 1: Open for Business (Red Hood/Arsenal #1)",Books,£25.48,£25.48,£25.48,In stock (14 available),Sequential Art
Pet Sematary,Books,£10.56,£10.56,£10.56,In stock (14 available),Horror
"Overload: How to Unplug, Unwind, and Unleash Yourself from the Pressure of Stress",Books,£52.15,£52.15,£52.15,In stock (14 available),Self Help
Robin War,Books,£47.82,£47.82,£47.82,In stock (14 available),Sequential Art
See America: A Celebration of Our National Parks & Treasured Sites,Books,£48.87,£48.87,£48.87,In stock (14 available),Travel
"Quarter Life Poetry: Poems for the Young, Broke and Hangry",Books,£50.89,£50.89,£50.89,In stock (14 available),Poetry
Old School (Diary of a Wimpy Kid #10),Books,£11.83,£11.83,£11.83,In stock (14 available),Humor
No Dream Is Too High: Life Lessons From a Man Who Walked on the Moon,Books,£21.95,£21.95,£21.95,In stock (14 available),Nonfiction
salt.,Books,£46.78,£46.78,£46.78,In stock (14 available),Poetry
Shtum,Books,£55.84,£55.84,£55.84,In stock (14 available),Fiction
"So Cute It Hurts!!, Vol. 6 (So Cute It Hurts!! #6)",Books,£35.43,£35.43,£35.43,In stock (14 available),Sequential Art
Someone Like You (The Harrisons #2),Books,£52.79,£52.79,£52.79,In stock (14 available),Contemporary
Sorting the Beef from the Bull: The Science of Food Fraud Forensics,Books,£44.74,£44.74,£44.74,In stock (14 available),Science
Steve Jobs,Books,£39.50,£39.50,£39.50,In stock (14 available),Default
Still Life with Bread Crumbs,Books,£26.41,£26.41,£26.41,In stock (14 available),Fiction
Superman Vol. 1: Before Truth (Superman by Gene Luen Yang #1),Books,£11.89,£11.89,£11.89,In stock (14 available),Sequential Art
"Naruto (3-in-1 Edition), Vol. 14: Includes Vols. 40, 41 & 42 (Naruto: Omnibus #14)",Books,£38.39,£38.39,£38.39,In stock (14 available),Sequential Art
Swell: A Year of Waves,Books,£45.58,£45.58,£45.58,In stock (14 available),Nonfiction
Love Is a Mix Tape (Music #1),Books,£18.03,£18.03,£18.03,In stock (14 available),Music
Island of Dragons (Unwanteds #7),Books,£29.65,£29.65,£29.65,In stock (14 available),Fantasy
Let It Out: A Journey Through Journaling,Books,£26.79,£26.79,£26.79,In stock (14 available),Nonfiction
I Know What I'm Doing -- and Other Lies I Tell Myself: Dispatches from a Life Under Construction,Books,£25.98,£25.98,£25.98,In stock (14 available),Humor
Lady Midnight (The Dark Artifices #1),Books,£16.28,£16.28,£16.28,In stock (14 available),Default
Looking for Lovely: Collecting the Moments that Matter,Books,£29.14,£29.14,£29.14,In stock (14 available),Nonfiction
"It's All Easy: Healthy, Delicious Weeknight Meals in under 30 Minutes",Books,£19.55,£19.55,£19.55,In stock (14 available),Food and Drink
"Living Leadership by Insight: A Good Leader Achieves, a Great Leader Builds Monuments",Books,£46.91,£46.91,£46.91,In stock (14 available),Default
Lowriders to the Center of the Earth (Lowriders in Space #2),Books,£51.51,£51.51,£51.51,In stock (14 available),Sequential Art
Luckiest Girl Alive,Books,£49.83,£49.83,£49.83,In stock (14 available),Default
Luis Paints the World,Books,£53.95,£53.95,£53.95,In stock (14 available),Childrens
Made to Stick: Why Some Ideas Survive and Others Die,Books,£38.85,£38.85,£38.85,In stock (14 available),Business
More Than Music (Chasing the Dream #1),Books,£37.61,£37.61,£37.61,In stock (14 available),Add a comment
Mr. Mercedes (Bill Hodges Trilogy #1),Books,£28.90,£28.90,£28.90,In stock (14 available),Fiction
My Kind of Crazy,Books,£40.36,£40.36,£40.36,In stock (14 available),Young Adult
My Mrs. Brown,Books,£24.48,£24.48,£24.48,In stock (14 available),Fiction
"Hush, Hush (Hush, Hush #1)",Books,£47.02,£47.02,£47.02,In stock (14 available),Default
I Am Pilgrim (Pilgrim #1),Books,£10.60,£10.60,£10.60,In stock (14 available),Fiction
"Hyperbole and a Half: Unfortunate Situations, Flawed Coping Mechanisms, Mayhem, and Other Things That Happened",Books,£14.75,£14.75,£14.75,In stock (14 available),Humor
My Name Is Lucy Barton,Books,£41.56,£41.56,£41.56,In stock (14 available),Fiction
Every Last Word,Books,£46.47,£46.47,£46.47,In stock (14 available),Default
Feathers: Displays of Brilliant Plumage,Books,£49.05,£49.05,£49.05,In stock (14 available),Art
Glory over Everything: Beyond The Kitchen House,Books,£45.84,£45.84,£45.84,In stock (14 available),Historical Fiction
"Eaternity: More than 150 Deliciously Easy Vegan Recipes for a Long, Healthy, Satisfied, Joyful Life",Books,£51.75,£51.75,£51.75,In stock (14 available),Nonfiction
Eligible (The Austen Project #4),Books,£27.09,£27.09,£27.09,In stock (14 available),Fiction
God: The Most Unpleasant Character in All Fiction,Books,£30.03,£30.03,£30.03,In stock (14 available),Religion
Greek Mythic History,Books,£10.23,£10.23,£10.23,In stock (14 available),Default
"Far & Away: Places on the Brink of Change: Seven Continents, Twenty-Five Years",Books,£15.06,£15.06,£15.06,In stock (14 available),Nonfiction
Eight Hundred Grapes,Books,£14.39,£14.39,£14.39,In stock (14 available),Fiction
Hamilton: The Revolution,Books,£58.79,£58.79,£58.79,In stock (14 available),Nonfiction
El Deafo,Books,£57.62,£57.62,£57.62,In stock (14 available),Sequential Art
Hold Your Breath (Search and Rescue #1),Books,£28.82,£28.82,£28.82,In stock (14 available),Romance
Cometh the Hour (The Clifton Chronicles #6),Books,£25.01,£25.01,£25.01,In stock (14 available),Fiction
Daily Fantasy Sports,Books,£36.58,£36.58,£36.58,In stock (14 available),Default
Dear Mr. Knightley,Books,£11.21,£11.21,£11.21,In stock (14 available),Fiction
Demigods & Magicians: Percy and Annabeth Meet the Kanes (Percy Jackson & Kane Chronicles Crossover #1-3),Books,£37.51,£37.51,£37.51,In stock (14 available),Fantasy
Doctor Sleep (The Shining #2),Books,£40.12,£40.12,£40.12,In stock (14 available),Horror
Crazy Love: Overwhelmed by a Relentless God,Books,£47.72,£47.72,£47.72,In stock (14 available),Christian
Don't Get Caught,Books,£55.35,£55.35,£55.35,In stock (14 available),Young Adult
"Eat Fat, Get Thin",Books,£54.07,£54.07,£54.07,In stock (14 available),Health
Brain on Fire: My Month of Madness,Books,£49.32,£49.32,£49.32,In stock (14 available),Nonfiction
Carrie,Books,£46.23,£46.23,£46.23,In stock (14 available),Default
Buying In: The Secret Dialogue Between What We Buy and Who We Are,Books,£37.80,£37.80,£37.80,In stock (14 available),Nonfiction
Batman: Europa,Books,£32.01,£32.01,£32.01,In stock (14 available),Sequential Art
Art Ops Vol. 1,Books,£48.80,£48.80,£48.80,In stock (14 available),Sequential Art
"Carry On, Warrior: Thoughts on Life Unarmed",Books,£31.85,£31.85,£31.85,In stock (14 available),Default
Catching Jordan (Hundred Oaks),Books,£50.83,£50.83,£50.83,In stock (14 available),Young Adult
Cell,Books,£20.29,£20.29,£20.29,In stock (14 available),Add a comment
Balloon Animals,Books,£17.03,£17.03,£17.03,In stock (14 available),Fiction
Barefoot Contessa Back to Basics,Books,£28.01,£28.01,£28.01,In stock (14 available),Food and Drink
City of Ashes (The Mortal Instruments #2),Books,£47.27,£47.27,£47.27,In stock (14 available),Default
Barefoot Contessa at Home: Everyday Recipes You'll Make Over and Over Again,Books,£50.62,£50.62,£50.62,In stock (14 available),Food and Drink
City of Bones (The Mortal Instruments #1),Books,£43.28,£43.28,£43.28,In stock (14 available),Default
City of Fallen Angels (The Mortal Instruments #4),Books,£11.23,£11.23,£11.23,In stock (14 available),Default
City of Glass (The Mortal Instruments #3),Books,£56.02,£56.02,£56.02,In stock (14 available),Fantasy
Clockwork Angel (The Infernal Devices #1),Books,£44.14,£44.14,£44.14,In stock (14 available),Default
Angels Walking (Angels Walking #1),Books,£34.20,£34.20,£34.20,In stock (14 available),Add a comment
Angels & Demons (Robert Langdon #1),Books,£51.48,£51.48,£51.48,In stock (14 available),Default
Code Name Verity (Code Name Verity #1),Books,£22.13,£22.13,£22.13,In stock (14 available),Add a comment
Searching for Meaning in Gailana,Books,£38.73,£38.73,£38.73,In stock (13 available),Fantasy
"The Three Searches, Meaning, and the Story",Books,£13.33,£13.33,£13.33,In stock (13 available),Default
A Distant Mirror: The Calamitous 14th Century,Books,£14.58,£14.58,£14.58,In stock (14 available),History
A Man Called Ove,Books,£39.72,£39.72,£39.72,In stock (14 available),Fiction
Rook,Books,£37.86,£37.86,£37.86,In stock (13 available),Add a comment
1491: New Revelations of the Americas Before Columbus,Books,£21.80,£21.80,£21.80,In stock (14 available),History
A People's History of the United States,Books,£40.79,£40.79,£40.79,In stock (14 available),Add a comment
"A Series of Catastrophes and Miracles: A True Story of Love, Science, and Cancer",Books,£56.48,£56.48,£56.48,In stock (14 available),Add a comment
A Study in Scarlet (Sherlock Holmes #1),Books,£16.73,£16.73,£16.73,In stock (14 available),Mystery
A Time of Torment (Charlie Parker #14),Books,£48.35,£48.35,£48.35,In stock (14 available),Mystery
A Brush of Wings (Angels Walking #3),Books,£55.51,£55.51,£55.51,In stock (14 available),Add a comment
Abstract City,Books,£56.37,£56.37,£56.37,In stock (14 available),Nonfiction
"Adulthood Is a Myth: A ""Sarah's Scribbles"" Collection",Books,£10.90,£10.90,£10.90,In stock (14 available),Sequential Art
All the Light We Cannot See,Books,£29.87,£29.87,£29.87,In stock (14 available),Historical
The Silent Sister (Riley MacPherson #1),Books,£46.29,£46.29,£46.29,In stock (12 available),Fiction
The Star-Touched Queen,Books,£32.30,£32.30,£32.30,In stock (12 available),Fantasy
Tipping Point for Planet Earth: How Close Are We to the Edge?,Books,£37.55,£37.55,£37.55,In stock (12 available),Science
Aristotle and Dante Discover the Secrets of the Universe (Aristotle and Dante Discover the Secrets of the Universe #1),Books,£58.14,£58.14,£58.14,In stock (14 available),Young Adult
Will You Won't You Want Me?,Books,£13.86,£13.86,£13.86,In stock (12 available),Womens Fiction
13 Hours: The Inside Account of What Really Happened In Benghazi,Books,£27.06,£27.06,£27.06,In stock (13 available),Nonfiction
My Kitchen Year: 136 Recipes That Saved My Life,Books,£11.53,£11.53,£11.53,In stock (13 available),Food and Drink
The Diary of a Young Girl,Books,£59.90,£59.90,£59.90,In stock (12 available),Nonfiction
The Golden Condom: And Other Essays on Love Lost and Found,Books,£39.43,£39.43,£39.43,In stock (12 available),Psychology
The Dinner Party,Books,£56.54,£56.54,£56.54,In stock (12 available),Fiction
The Epidemic (The Program 0.6),Books,£14.44,£14.44,£14.44,In stock (12 available),Young Adult
Raspberry Pi Electronics Projects for the Evil Genius,Books,£49.67,£49.67,£49.67,In stock (12 available),Default
The Gray Rhino: How to Recognize and Act on the Obvious Dangers We Ignore,Books,£59.15,£59.15,£59.15,In stock (12 available),Add a comment
The Lonely City: Adventures in the Art of Being Alone,Books,£33.26,£33.26,£33.26,In stock (12 available),Nonfiction
The Midnight Watch: A Novel of the Titanic and the Californian,Books,£26.20,£26.20,£26.20,In stock (12 available),Add a comment
How to Speak Golf: An Illustrated Guide to Links Lingo,Books,£58.32,£58.32,£58.32,In stock (12 available),Default
The Children,Books,£11.88,£11.88,£11.88,In stock (12 available),Add a comment
Snatched: How A Drug Queen Went Undercover for the DEA and Was Kidnapped By Colombian Guerillas,Books,£21.21,£21.21,£21.21,In stock (12 available),Nonfiction
"Love, Lies and Spies",Books,£20.55,£20.55,£20.55,In stock (12 available),Historical Fiction
Most Wanted,Books,£35.28,£35.28,£35.28,In stock (12 available),Mystery
Murder at the 42nd Street Library (Raymond Ambler #1),Books,£54.36,£54.36,£54.36,In stock (12 available),Mystery
Poisonous (Max Revere Novels #3),Books,£26.80,£26.80,£26.80,In stock (12 available),Mystery
No Love Allowed (Dodge Cove #1),Books,£54.65,£54.65,£54.65,In stock (12 available),Young Adult
One with You (Crossfire #5),Books,£15.71,£15.71,£15.71,In stock (12 available),Add a comment
Quench Your Own Thirst: Business Lessons Learned Over a Beer or Two,Books,£43.14,£43.14,£43.14,In stock (12 available),Business
Playing with Fire,Books,£13.71,£13.71,£13.71,In stock (11 available),Mystery
"Setting the World on Fire: The Brief, Astonishing Life of St. Catherine of Siena",Books,£21.15,£21.15,£21.15,In stock (11 available),Biography
Take Me Home Tonight (Rock Star Romance #3),Books,£53.98,£53.98,£53.98,In stock (11 available),Romance
Sleeping Giants (Themis Files #1),Books,£48.74,£48.74,£48.74,In stock (11 available),Science Fiction
The Art of Startup Fundraising,Books,£21.00,£21.00,£21.00,In stock (11 available),Business
Psycho: Sanitarium (Psycho #1.5),Books,£36.97,£36.97,£36.97,In stock (12 available),Horror
The Improbability of Love,Books,£59.45,£59.45,£59.45,In stock (11 available),Fiction
"The Sleep Revolution: Transforming Your Life, One Night at a Time",Books,£11.68,£11.68,£11.68,In stock (11 available),Nonfiction
Off the Hook (Fishing for Trouble #1),Books,£47.67,£47.67,£47.67,In stock (11 available),Romance
The Widow,Books,£27.26,£27.26,£27.26,In stock (11 available),Mystery
Troublemaker: Surviving Hollywood and Scientology,Books,£48.39,£48.39,£48.39,In stock (11 available),Default
"A la Mode: 120 Recipes in 60 Pairings: Pies, Tarts, Cakes, Crisps, and More Topped with Ice Cream, Gelato, Frozen Custard, and More",Books,£38.77,£38.77,£38.77,In stock (12 available),Food and Drink
A Paris Apartment,Books,£39.01,£39.01,£39.01,In stock (12 available),Historical Fiction
Boar Island (Anna Pigeon #19),Books,£59.48,£59.48,£59.48,In stock (12 available),Mystery
Can You Keep a Secret? (Fear Street Relaunch #4),Books,£48.64,£48.64,£48.64,In stock (12 available),Horror
Dirty (Dive Bar #1),Books,£40.83,£40.83,£40.83,In stock (12 available),Romance
Eleanor & Park,Books,£56.51,£56.51,£56.51,In stock (12 available),Default
Equal Is Unfair: America's Misguided Fight Against Income Inequality,Books,£56.86,£56.86,£56.86,In stock (12 available),Politics
Everyday Italian: 125 Simple and Delicious Recipes,Books,£20.10,£20.10,£20.10,In stock (12 available),Food and Drink
Furiously Happy: A Funny Book About Horrible Things,Books,£41.46,£41.46,£41.46,In stock (12 available),Nonfiction
Hide Away (Eve Duncan #20),Books,£11.84,£11.84,£11.84,In stock (12 available),Mystery
Arena,Books,£21.36,£21.36,£21.36,In stock (11 available),Science Fiction
Stars Above (The Lunar Chronicles #4.5),Books,£48.05,£48.05,£48.05,In stock (12 available),Young Adult
Born for This: How to Find the Work You Were Meant to Do,Books,£21.59,£21.59,£21.59,In stock (11 available),Business
Cravings: Recipes for What You Want to Eat,Books,£20.50,£20.50,£20.50,In stock (11 available),Food and Drink
Daredevils,Books,£16.34,£16.34,£16.34,In stock (11 available),Fiction
"Exit, Pursued by a Bear",Books,£51.34,£51.34,£51.34,In stock (11 available),Young Adult
Grey (Fifty Shades #4),Books,£48.49,£48.49,£48.49,In stock (11 available),Womens Fiction
10-Day Green Smoothie Cleanse: Lose Up to 15 Pounds in 10 Days!,Books,£49.71,£49.71,£49.71,In stock (10 available),Health
"10% Happier: How I Tamed the Voice in My Head, Reduced Stress Without Losing My Edge, and Found Self-Help That Actually Works",Books,£24.57,£24.57,£24.57,In stock (10 available),Nonfiction
11/22/63,Books,£48.48,£48.48,£48.48,In stock (11 available),Fiction
A Gentleman's Position (Society of Gentlemen #3),Books,£14.75,£14.75,£14.75,In stock (11 available),Romance
A Mother's Reckoning: Living in the Aftermath of Tragedy,Books,£19.53,£19.53,£19.53,In stock (11 available),Nonfiction
Adultery,Books,£20.88,£20.88,£20.88,In stock (11 available),Default
It Didn't Start with You: How Inherited Family Trauma Shapes Who We Are and How to End the Cycle,Books,£56.27,£56.27,£56.27,In stock (11 available),Psychology
Keep Me Posted,Books,£20.46,£20.46,£20.46,In stock (11 available),Womens Fiction
Lab Girl,Books,£40.85,£40.85,£40.85,In stock (11 available),Autobiography
Lies and Other Acts of Love,Books,£45.14,£45.14,£45.14,In stock (11 available),Fiction
Lilac Girls,Books,£17.28,£17.28,£17.28,In stock (11 available),Historical Fiction
M Train,Books,£27.18,£27.18,£27.18,In stock (11 available),Autobiography
"Mother, Can You Not?",Books,£16.89,£16.89,£16.89,In stock (11 available),Nonfiction
Mothering Sunday,Books,£13.34,£13.34,£13.34,In stock (11 available),Fiction
Nap-a-Roo,Books,£25.08,£25.08,£25.08,In stock (9 available),Childrens
"NaNo What Now? Finding your editing process, revising your NaNoWriMo book and building a writing career through publishing and beyond",Books,£10.41,£10.41,£10.41,In stock (9 available),Default
The Alien Club,Books,£54.40,£54.40,£54.40,In stock (9 available),Young Adult
The Book of Mormon,Books,£24.57,£24.57,£24.57,In stock (9 available),Religion
The Art and Science of Low Carbohydrate Living,Books,£52.98,£52.98,£52.98,In stock (9 available),Health
"The Fabric of the Cosmos: Space, Time, and the Texture of Reality",Books,£55.91,£55.91,£55.91,In stock (9 available),Science
Suzie Snowflake: One beautiful flake (a self-esteem story),Books,£54.81,£54.81,£54.81,In stock (9 available),Novels
The Flowers Lied,Books,£16.68,£16.68,£16.68,In stock (9 available),Default
"The Moosewood Cookbook: Recipes from Moosewood Restaurant, Ithaca, New York",Books,£12.34,£12.34,£12.34,In stock (9 available),Food and Drink
The New Brand You: Your New Image Makes the Sale for You,Books,£44.05,£44.05,£44.05,In stock (9 available),Default
The Shack,Books,£28.03,£28.03,£28.03,In stock (9 available),Fiction
Underlying Notes,Books,£11.82,£11.82,£11.82,In stock (9 available),Default
Unlimited Intuition Now,Books,£58.87,£58.87,£58.87,In stock (9 available),Default
Without Shame,Books,£48.27,£48.27,£48.27,In stock (9 available),Add a comment
Watchmen,Books,£58.05,£58.05,£58.05,In stock (9 available),Add a comment
Don't Forget Steven,Books,£33.23,£33.23,£33.23,In stock (9 available),Young Adult
Dress Your Family in Corduroy and Denim,Books,£43.68,£43.68,£43.68,In stock (9 available),Humor
"Fruits Basket, Vol. 9 (Fruits Basket #9)",Books,£33.95,£33.95,£33.95,In stock (9 available),Sequential Art
If I Gave You God's Phone Number....: Searching for Spirituality in America,Books,£20.91,£20.91,£20.91,In stock (9 available),Spirituality
Modern Day Fables,Books,£47.44,£47.44,£47.44,In stock (9 available),Default
The Martian (The Martian #1),Books,£41.39,£41.39,£41.39,In stock (8 available),Default
"The Midnight Assassin: Panic, Scandal, and the Hunt for America's First Serial Killer",Books,£28.45,£28.45,£28.45,In stock (8 available),Nonfiction
The New Drawing on the Right Side of the Brain,Books,£43.02,£43.02,£43.02,In stock (8 available),Art
The Unlikely Pilgrimage of Harold Fry (Harold Fry #1),Books,£43.62,£43.62,£43.62,In stock (8 available),Default
Vagabonding: An Uncommon Guide to the Art of Long-Term World Travel,Books,£36.94,£36.94,£36.94,In stock (8 available),Travel
When Breath Becomes Air,Books,£39.36,£39.36,£39.36,In stock (8 available),Nonfiction
Why Not Me?,Books,£17.76,£17.76,£17.76,In stock (8 available),Nonfiction
The Grownup,Books,£35.88,£35.88,£35.88,In stock (8 available),Short Stories
The High Mountains of Portugal,Books,£51.15,£51.15,£51.15,In stock (8 available),Fiction
"Zero to One: Notes on Startups, or How to Build the Future",Books,£34.06,£34.06,£34.06,In stock (8 available),Nonfiction
23 Degrees South: A Tropical Tale of Changing Whether...,Books,£35.79,£35.79,£35.79,In stock (9 available),Add a comment
Shadows of the Past (Logan Point #1),Books,£39.67,£39.67,£39.67,In stock (8 available),Christian Fiction
Silence in the Dark (Logan Point #4),Books,£58.33,£58.33,£58.33,In stock (8 available),Suspense
Smarter Faster Better: The Secrets of Being Productive in Life and Business,Books,£38.89,£38.89,£38.89,In stock (8 available),Nonfiction
The E-Myth Revisited: Why Most Small Businesses Don't Work and What to Do About It,Books,£36.91,£36.91,£36.91,In stock (8 available),Business
South of Sunshine,Books,£28.93,£28.93,£28.93,In stock (8 available),Young Adult
A Hero's Curse (The Unseen Chronicles #1),Books,£50.49,£50.49,£50.49,In stock (9 available),Add a comment
A Shard of Ice (The Black Symphony Saga #1),Books,£56.63,£56.63,£56.63,In stock (9 available),Fantasy
Art and Fear: Observations on the Perils (and Rewards) of Artmaking,Books,£48.63,£48.63,£48.63,In stock (9 available),Art
Chernobyl 01:23:40: The Incredible True Story of the World's Worst Nuclear Disaster,Books,£35.92,£35.92,£35.92,In stock (9 available),Nonfiction
I'll Give You the Sun,Books,£56.48,£56.48,£56.48,In stock (8 available),Default
Les Fleurs du Mal,Books,£29.04,£29.04,£29.04,In stock (8 available),Poetry
Kill 'Em and Leave: Searching for James Brown and the American Soul,Books,£45.05,£45.05,£45.05,In stock (8 available),Music
Left Behind (Left Behind #1),Books,£40.72,£40.72,£40.72,In stock (8 available),Default
"Love That Boy: What Two Presidents, Eight Road Trips, and My Son Taught Me About a Parent's Expectations",Books,£25.06,£25.06,£25.06,In stock (8 available),Nonfiction
Living Forward: A Proven Plan to Stop Drifting and Get the Life You Want,Books,£12.55,£12.55,£12.55,In stock (8 available),Nonfiction
Man's Search for Meaning,Books,£29.48,£29.48,£29.48,In stock (8 available),Nonfiction
Miller's Valley,Books,£58.54,£58.54,£58.54,In stock (8 available),Fiction
Out of Print: City Lights Spotlight No. 14,Books,£53.64,£53.64,£53.64,In stock (8 available),Poetry
John Vassos: Industrial Design for Modern Life,Books,£20.22,£20.22,£20.22,In stock (8 available),Default
My Life Next Door (My Life Next Door ),Books,£36.39,£36.39,£36.39,In stock (8 available),Young Adult
Proofs of God: Classical Arguments from Tertullian to Barth,Books,£54.21,£54.21,£54.21,In stock (8 available),Philosophy
Please Kill Me: The Uncensored Oral History of Punk,Books,£31.19,£31.19,£31.19,In stock (8 available),Music
Rising Strong,Books,£21.82,£21.82,£21.82,In stock (8 available),Nonfiction
Roller Girl,Books,£14.10,£14.10,£14.10,In stock (8 available),Sequential Art
Kierkegaard: A Christian Missionary to Christians,Books,£47.13,£47.13,£47.13,In stock (8 available),Philosophy
Howl and Other Poems,Books,£40.45,£40.45,£40.45,In stock (8 available),Poetry
I Will Find You,Books,£44.21,£44.21,£44.21,In stock (8 available),Nonfiction
History of Beauty,Books,£10.29,£10.29,£10.29,In stock (8 available),Art
Wildlife of New York: A Five-Borough Coloring Book,Books,£22.14,£22.14,£22.14,In stock (7 available),Default
"A Murder Over a Girl: Justice, Gender, Junior High",Books,£13.20,£13.20,£13.20,In stock (8 available),Nonfiction
You Are a Badass: How to Stop Doubting Your Greatness and Start Living an Awesome Life,Books,£12.08,£12.08,£12.08,In stock (7 available),Self Help
32 Yolks,Books,£53.63,£53.63,£53.63,In stock (8 available),Food and Drink
